Date,Time,Duration(in hours),Activity
2024-09-03, 9:15, 2.25, group discussion on first steps / code guidelines
2024-09-03, 15:00, 1.5, first project lecture
2024-09-04, 11:00, 3, group discussion and started on PoA
2024-09-05, 11:00, 0.75, Finished first version of document inventory and communacation sections in PoA
2024-09-09, 11:00, 0.5, Group meeting
2024-09-09, 11:30, 3, started research
2024-09-10, 12:30, 1, prepare meeting bob
2024-09-10, 13:30, 0.5, group meeting bob
2024-09-11, 9:30, 2, working on tiled2d POC
2024-09-12, 14:00, 2.5, working on tiled2D POC
2024-09-13, 12:30, 0.5, working on tiled2D POC
2024-09-14, 16:45, 0.5, tiled2D POC fixed libs
2024-09-15, 13:30, 3, worked on level research
2024-09-15, 23:00, 1, working on tiled2D POC
2024-09-16, 9:15, 0.25, group meeting
2024-09-16, 9:30, 5.5, worked on fixing libraries for Tiled2D POC
2024-09-17, 15:20, 1, worked on fixing libraries for Tiled2D POC